[
  {
    "finding_id": "FIND-001",
    "repo_name": "legacy-backend",
    "finding_type": "hardcoded_secret",
    "category": "secret_exposure",
    "severity_hint": "high",
    "source": "rust_scanner",
    "file": "legacy/old_export_api.py",
    "line": 12,
    "endpoint": "/api/v1/export-users",
    "database_table": null,
    "evidence": "Hardcoded API key detected in legacy export endpoint",
    "masked_value": "sk_test_****92fa",
    "timestamp": "2026-05-16T12:00:00Z"
  },
  {
    "finding_id": "FIND-002",
    "repo_name": "legacy-backend",
    "finding_type": "deprecated_api",
    "category": "legacy_api",
    "severity_hint": "medium",
    "source": "rust_scanner",
    "file": "legacy/old_export_api.py",
    "line": 8,
    "endpoint": "/api/v1/export-users",
    "database_table": null,
    "evidence": "Deprecated export endpoint still accessible",
    "masked_value": null,
    "timestamp": "2026-05-16T12:01:00Z"
  },
  {
    "finding_id": "FIND-003",
    "repo_name": "legacy-backend",
    "finding_type": "runtime_anomaly",
    "category": "runtime_behavior",
    "severity_hint": "medium",
    "source": "mock_data",
    "file": null,
    "line": null,
    "endpoint": "/api/v1/export-users",
    "database_table": null,
    "evidence": "Repeated suspicious access to deprecated endpoint (47 requests in 10 minutes)",
    "masked_value": null,
    "timestamp": "2026-05-16T12:05:00Z"
  },
  {
    "finding_id": "FIND-004",
    "repo_name": "legacy-backend",
    "finding_type": "database_anomaly",
    "category": "database_activity",
    "severity_hint": "high",
    "source": "mock_data",
    "file": null,
    "line": null,
    "endpoint": null,
    "database_table": "users",
    "evidence": "Abnormal read spike on users table (2,847 rows read in 5 minutes)",
    "masked_value": null,
    "timestamp": "2026-05-16T12:06:00Z"
  },
  {
    "finding_id": "FIND-005",
    "repo_name": "infra-config",
    "finding_type": "infrastructure_risk",
    "category": "infrastructure",
    "severity_hint": "medium",
    "source": "rust_scanner",
    "file": "gateway.yml",
    "line": 23,
    "endpoint": "/api/v1/export-users",
    "database_table": null,
    "evidence": "Gateway configuration still routes to deprecated export endpoint",
    "masked_value": null,
    "timestamp": "2026-05-16T12:02:00Z"
  }
]